{
  "id": "02fe16a3-2602-49c0-86a7-b88aebcdb838",
  "firstname": "Tom",
  "lastname": "Bombadil",
  "avatar": "https://dg2kcfbxc77v1.cloudfront.net/assets/images/avatar/turtle-be4183af0f9b5268439d4193e8da743d.png",
  "work_role": "Neoplasm Researcher",
  "company": "Illumina",
  "created_at": "2017-04-16T23:59:14.648Z"
}
