{
  "id": "045cbcac-a9a2-4c3d-8c3f-5f005aa47643",
  "firstname": "Istar",
  "lastname": "Eldritch",
  "avatar": "https://dg2kcfbxc77v1.cloudfront.net/assets/images/avatar/turtle-be4183af0f9b5268439d4193e8da743d.png",
  "work_role": "Backend Developer",
  "company": "Repositive",
  "created_at": "2017-04-16T23:59:14.648Z"
}
